{
  "recipe_id": "literature_landscape",
  "name": "Literature Landscape",
  "description": "Build a landscape and reading-list seed from atomic search, topic, network, and provenance operators.",
  "entry_tool": "literature_workflows.resolve",
  "steps": [
    {
      "id": "seed_search",
      "action": "discover.seed_search",
      "purpose": "Run a broad keyword search to seed the landscape",
      "required_capabilities": [
        "supports_keyword_search"
      ],
      "preferred_providers": [
        "inspire",
        "openalex",
        "arxiv"
      ],
      "degrade_mode": "fail_closed",
      "consumer_hints": {
        "phases": [
          "prework"
        ],
        "artifact": "seed_search"
      },
      "params": {
        "query": "<query>",
        "size": 25
      }
    },
    {
      "id": "topic_scan",
      "action": "analyze.topic_evolution",
      "purpose": "Summarize topic trends and emerging subtopics",
      "depends_on": [
        "seed_search"
      ],
      "required_capabilities": [
        "analysis.topic_evolution"
      ],
      "preferred_providers": [
        "inspire"
      ],
      "degrade_mode": "partial_result",
      "consumer_hints": {
        "phases": [
          "prework"
        ],
        "artifact": "topic_analysis"
      },
      "params": {
        "mode": "timeline",
        "topic": "<topic>",
        "limit": 20
      }
    },
    {
      "id": "citation_network",
      "action": "analyze.citation_network",
      "purpose": "Map the citation structure around an anchor paper",
      "depends_on": [
        "seed_search"
      ],
      "required_capabilities": [
        "analysis.citation_network"
      ],
      "preferred_providers": [
        "inspire"
      ],
      "degrade_mode": "partial_result",
      "consumer_hints": {
        "phases": [
          "prework"
        ],
        "artifact": "network_analysis"
      },
      "params": {
        "mode": "citation",
        "seed": "<seed_recid>",
        "limit": 25
      }
    },
    {
      "id": "source_trace",
      "action": "analyze.provenance_trace",
      "purpose": "Trace likely original sources for a representative anchor paper",
      "depends_on": [
        "citation_network"
      ],
      "required_capabilities": [
        "analysis.provenance_trace"
      ],
      "preferred_providers": [
        "inspire"
      ],
      "degrade_mode": "partial_result",
      "consumer_hints": {
        "phases": [
          "prework"
        ],
        "artifact": "source_trace"
      },
      "params": {
        "recid": "<seed_recid>",
        "max_depth": 2,
        "max_refs_per_level": 20
      }
    }
  ]
}
